{
  "messageId": "message-id-example",
  "type": "SessionEnded",
  "version": "1.0.0",
  "occurredAt": "2026-09-08T12:00:00Z",
  "tenantId": "tenant-id-example",
  "regionId": "region-id-example",
  "clusterId": "cluster-id-example",
  "correlationId": "correlation-id-example",
  "data": {
    "sessionId": "session-id-example",
    "ownerEpoch": "1",
    "reason": "completed",
    "finalTick": "1",
    "resultDigest": "aaaaaaaaaaaaaaaaaaaaaaaaaaaaaaaaaaaaaaaaaaaaaaaaaaaaaaaaaaaaaaaa",
    "endedAt": "2026-09-08T12:00:00Z"
  },
  "aggregateId": "aggregate-id-example",
  "aggregateRevision": "1",
  "causationId": "causation-id-example"
}
